"name","description","activities","state"
"Yosemite National Park","Renowned for its granite cliffs, waterfalls, and giant sequoias.","1. Hiking on scenic trails like Mist Trail and Mariposa Grove. 2. Rock climbing at El Capitan and Half Dome. 3. Wildlife watching for bears, deer, and other animals. 4. Stargazing at Glacier Point. 5. Photographing iconic landmarks like Tunnel View and Yosemite Falls.","CA"
"Golden Gate Bridge","San Francisco's iconic suspension bridge.","1. Walking or biking across the bridge. 2. Visiting the Golden Gate Bridge Welcome Center. 3. Capturing photos from various viewpoints like Battery Spencer and Crissy Field. 4. Exploring the nearby Golden Gate Park. 5. Taking a boat tour underneath the bridge.","CA"
"Disneyland","The world-famous theme park located in Anaheim.","1. Riding classic attractions like Pirates of the Caribbean and Space Mountain. 2. Watching live shows and parades, such as Fantasmic! and the Main Street Electrical Parade. 3. Meeting Disney characters for photo opportunities. 4. Exploring themed lands like Star Wars: Galaxy's Edge and New Orleans Square. 5. Enjoying delicious food and snacks, like Dole Whips and churros.","CA"
"Universal Studios Hollywood","A popular film studio and theme park in Los Angeles.","1. Experiencing thrilling rides like Jurassic World: The Ride and Revenge of the Mummy. 2. Taking the Studio Tour to see behind-the-scenes of movie productions. 3. Watching live shows, such as WaterWorld and Special Effects Show. 4. Exploring themed areas like The Wizarding World of Harry Potter and Springfield. 5. Dining at unique restaurants like Krusty Burger and Three Broomsticks.","CA"
"Death Valley National Park","Known for its unique desert landscapes, salt flats, and sand dunes.","1. Hiking trails like Golden Canyon and Mesquite Flat Sand Dunes. 2. Admiring the colorful badlands at Zabriskie Point. 3. Exploring unique sites like Racetrack Playa and Ubehebe Crater. 4. Photographing the salt flats at Badwater Basin. 5. Stargazing in one of the darkest skies in the United States.","CA"
"Pacific Coast Highway","A scenic drive along the California coast, offering breathtaking ocean views.","1. Drive along the coastline, 2. Stop at vista points for photo opportunities, 3. Explore beach towns, 4. Hike nearby coastal trails, 5. Visit state parks and beaches","CA"
"Muir Woods National Monument","A tranquil forest reserve with towering redwood trees.","1. Hike through the redwood forest, 2. Attend a ranger-led program, 3. Photograph the giant trees, 4. Birdwatching, 5. Visit the visitor center and bookstore","CA"
"Catalina Island","A popular island getaway with outdoor activities and charming towns.","1. Snorkel or scuba dive, 2. Explore Avalon or Two Harbors, 3. Go hiking or biking, 4. Take a glass-bottom boat tour, 5. Enjoy shopping and dining","CA"
"Pfeiffer Beach","A picturesque beach in Big Sur known for its purple sand and unique rock formations.","1. Walk along the purple sand beach, 2. Photograph the rock formations, 3. Explore tide pools, 4. Enjoy a picnic, 5. Watch the sunset","CA"
"Lake Tahoe","A picturesque freshwater lake, Lake Tahoe is ideal for water sports and outdoor activities, nestled in the Sierra Nevada Mountains.","1. Enjoy water sports like kayaking, paddleboarding, and jet skiing. 2. Swim, sunbathe, or relax on the beaches, such as Sand Harbor or Pope Beach. 3. Hike or mountain bike through the surrounding trails, such as the Rubicon Trail and Flume Trail. 4. Ski or snowboard at nearby ski resorts like Heavenly or Squaw Valley. 5. Try your luck at the casinos on the Nevada side of the lake.","CA"
"Napa Valley","A premier wine region, Napa Valley boasts beautiful vineyards, wineries, and luxury accommodations, making it a popular destination for wine enthusiasts and tourists alike.","1. Go on a wine tasting tour at the various wineries in the region. 2. Experience the Napa Valley Wine Train for a scenic journey through wine country. 3. Dine at world-class restaurants such as The French Laundry or Farmstead. 4. Enjoy a hot air balloon ride for a bird's-eye view of the valley. 5. Pamper yourself with spa treatments at one of the luxury resorts or boutique hotels.","CA"
"Redwood National and State Parks","Home to the tallest trees on Earth, the California redwoods, Redwood National and State Parks offer majestic forests, pristine rivers, and an incredible sense of awe.","1. Hike through the beautiful trails, such as the Tall Trees Grove or the Lady Bird Johnson Grove. 2. Drive along the scenic Newton B. Drury Scenic Parkway or Avenue of the Giants. 3. Spot wildlife like elk, whales, and sea lions at various locations throughout the parks. 4. Camp under the stars and towering redwoods at designated campgrounds. 5. Visit the educational visitor centers and learn about the history and ecology of the redwoods.","CA"
"Hollywood Walk of Fame","A famous sidewalk in Los Angeles, the Hollywood Walk of Fame features stars dedicated to celebrities from the entertainment industry, attracting tourists from around the world.","1. Stroll along the Walk of Fame and find your favorite stars. 2. Take a guided tour of the area to learn more about Hollywood history. 3. Visit iconic landmarks such as the TCL Chinese Theatre and the Dolby Theatre. 4. Explore the Hollywood Museum and learn about the entertainment industry. 5. Shop and dine at the Hollywood & Highland shopping complex.","CA"
"Grand Canyon National Park","A world-renowned natural wonder with breathtaking views and hiking opportunities.","1. Hiking various trails, such as the South Kaibab, Bright Angel, and North Kaibab trails. 2. Take a helicopter or airplane tour for a bird's-eye view of the canyon. 3. Experience a guided mule ride down into the canyon or along the rim. 4. White-water rafting on the Colorado River through the canyon. 5. Participate in a ranger-led program, such as a fossil walk or stargazing session.","AZ"
"Sedona","A picturesque town surrounded by stunning red rock formations, popular for hiking and spiritual retreats.","1. Hiking and exploring the numerous trails, such as the Cathedral Rock, Devil's Bridge, and Bell Rock trails. 2. Enjoy a guided jeep tour through the rugged terrain and red rock formations. 3. Experience a rejuvenating spiritual retreat or meditation workshop in one of the town's many spiritual centers. 4. Take part in a hot air balloon ride for a unique view of Sedona's landscape. 5. Visit the Chapel of the Holy Cross, a remarkable architectural landmark.","AZ"
"Antelope Canyon","A visually striking slot canyon on Navajo land, known for its colorful sandstone walls.","1. Take a guided tour through the Upper or Lower Antelope Canyon, marveling at the swirling sandstone walls. 2. Capture stunning photographs of the canyon's unique light beams and rock formations. 3. Visit nearby Horseshoe Bend for a spectacular view of the Colorado River. 4. Explore the area's other slot canyons, such as Rattlesnake Canyon and Owl Canyon. 5. Learn about Navajo culture and history at the nearby Navajo Nation Museum.","AZ"
"Monument Valley","A scenic desert region with iconic sandstone buttes, located within the Navajo Nation.","1. Take a guided tour through the Monument Valley Navajo Tribal Park, visiting iconic landmarks like the Mittens and Totem Pole. 2. Drive the 17-mile Valley Drive, taking in the stunning scenery at each viewpoint. 3. Explore the area on horseback with a guided trail ride led by a Navajo guide. 4. Experience a traditional Navajo Hogan overnight stay, complete with storytelling and cultural demonstrations. 5. Hike the Wildcat Trail, a 3.2-mile loop around the base of West Mitten Butte.","AZ"
"Petrified Forest National Park","A unique park featuring fossilized trees, colorful badlands, and ancient petroglyphs.","1. Explore the park's many trails, such as the Crystal Forest, Blue Mesa, and Giant Logs trails, to view petrified wood and unique geological formations. 2. Visit the Painted Desert, a stunning area of colorful badlands, and marvel at its vibrant hues. 3. Discover ancient petroglyphs at Newspaper Rock or Puerco Pueblo, learning about the area's prehistoric inhabitants. 4. Take a scenic drive along the 28-mile park road, stopping at various overlooks and interpretive exhibits. 5. Attend a ranger-led program to learn more about the park's geology, paleontology, and cultural history.","AZ"